ROW_ID,ICD9_CODE,SHORT_TITLE,LONG_TITLE,CONCISE_TITLE
3050,7921,Open reduc-humerus fx,"Open reduction of fracture without internal fixation, humerus",Humerus Reduction
3051,7922,Open reduc-radius/uln fx,"Open reduction of fracture without internal fixation, radius and ulna",Radial-Ulna Reduction
3052,7923,Open reduc-metac/car fx,"Open reduction of fracture without internal fixation, carpals and metacarpals",Carpal and Metacarpal Reduction
3053,7924,Open reduction-finger fx,"Open reduction of fracture without internal fixation, phalanges of hand",Hand Fracture Reduction
3054,7925,Open reduction-femur fx,"Open reduction of fracture without internal fixation, femur",Femur Reduction
3055,7926,Open reduc-tibia/fib fx,"Open reduction of fracture without internal fixation, tibia and fibula",Tibia and Fibula Reduction
3056,7927,Open reduc-metat/tars fx,"Open reduction of fracture without internal fixation, tarsals and metatarsals",Tarsal and Metatarsal Reduction
3057,7928,Open reduction-toe fx,"Open reduction of fracture without internal fixation, phalanges of foot",Foot Fracture Reduction
3058,7929,Open fx reduction NEC,"Open reduction of fracture without internal fixation, other specified bone",Bone Reduction
3059,7930,Opn fx red w int fix NOS,"Open reduction of fracture with internal fixation, unspecified site",Fracture Reduction and Fixation
3060,7931,Open red-int fix humerus,"Open reduction of fracture with internal fixation, humerus",Humerus Reduction and Internal Fixation
3061,7932,Op red-int fix rad/ulna,"Open reduction of fracture with internal fixation, radius and ulna",Radial Ulna Reduction
3062,7933,Op red-int fix metac/car,"Open reduction of fracture with internal fixation, carpals and metacarpals",Carpal and Metacarpal Reduction
3063,7934,Open red-int fix finger,"Open reduction of fracture with internal fixation, phalanges of hand",Hand Fracture Reduction and Fixation
3064,7935,Open reduc-int fix femur,"Open reduction of fracture with internal fixation, femur",Femur Reduction and Internal Fixation
3065,7936,Op red-int fix tib/fibul,"Open reduction of fracture with internal fixation, tibia and fibula",Tibia and Fibula Reduction
3066,7937,Op red-int fix metat/tar,"Open reduction of fracture with internal fixation, tarsals and metatarsals",Tarsal and Metatarsal Reduction
3067,8111,Ankle fusion,Ankle fusion,Ankle Arthrodesis
3068,8112,Triple arthrodesis,Triple arthrodesis,Triple Arthrodesis
3069,8113,Subtalar fusion,Subtalar fusion,Foot Fusion
3070,8114,Midtarsal fusion,Midtarsal fusion,Tarsal Fusion
3071,8115,Tarsometatarsal fusion,Tarsometatarsal fusion,Tarsal Fusion
3072,8116,Metatarsophalangeal fus,Metatarsophalangeal fusion,MTP Fusion
3073,8117,Other fusion of foot,Other fusion of foot,Foot Fusion
3074,8118,Subtalr jt arthroereisis,Subtalar joint arthroereisis,Subtalar Joint Immobilization
3075,8120,Arthrodesis NOS,Arthrodesis of unspecified joint,Joint Arthrodesis
3076,8121,Arthrodesis of hip,Arthrodesis of hip,Hip Arthrodesis
3077,8122,Arthrodesis of knee,Arthrodesis of knee,Knee Arthrodesis
3078,8123,Arthrodesis of shoulder,Arthrodesis of shoulder,Shoulder Arthrodesis
3079,8124,Arthrodesis of elbow,Arthrodesis of elbow,Elbow Arthrodesis
3080,8125,Carporadial fusion,Carporadial fusion,Carpal Fusion
3081,8126,Metacarpocarpal fusion,Metacarpocarpal fusion,Hand Fusion
3082,8127,Metacarpophalangeal fus,Metacarpophalangeal fusion,MCP Fusion
3083,8128,Interphalangeal fusion,Interphalangeal fusion,IP Fusion
3084,8129,Arthrodesis NEC,Arthrodesis of other specified joints,Joint Arthrodesis
3085,8130,Spinal refusion NOS,"Refusion of spine, not otherwise specified",Spine Refusion
3086,8131,Refusion of atlas-axis,Refusion of atlas-axis spine,Atlanto-Axis Refusion
3087,8132,Refus oth cervcl ant/ant,"Refusion of other cervical spine, anterior column, anterior technique",Anterior Cervical Spine Refusion
3088,8133,Refus oth cerv post/post,"Refusion of other cervical spine, posterior column, posterior technique",Posterior Cervical Spine Refusion
3089,8134,Refus drs/drslmb ant/ant,"Refusion of dorsal and dorsolumbar spine, anterior column, anterior technique",Anterior Spine Fusion
3090,6733,Cervical les cryotherapy,Destruction of lesion of cervix by cryosurgery,Cryosurgery of Cervix
3091,6739,Cervical les destruc NEC,Other excision or destruction of lesion or tissue of cervix,Cervix Excision or Destruction
3092,674,Amputation of cervix,Amputation of cervix,Cervix Amputation
3093,6751,Transab cerclage cervix,Transabdominal cerclage of cervix,Cervical Cerclage
3094,734,Medical induction labor,Medical induction of labor,Induction of Labor
3095,7351,Manual rotat fetal head,Manual rotation of fetal head,Fetal Head Rotation
3096,7359,Manual assist deliv NEC,Other manually assisted delivery,Manually Assisted Delivery
3097,736,Episiotomy,Episiotomy,Epi
3098,738,Fetal ops-facilitate del,Operations on fetus to facilitate delivery,Fetal Delivery
3099,7391,Ext version-assist deliv,External version assisting delivery,Assisted Delivery
3100,7392,Replace prolapsed cord,Replacement of prolapsed umbilical cord,Umbilical Cord Replacement
3101,7393,Incis cx to assist deliv,Incision of cervix to assist delivery,Cervical Incision for Delivery
3102,7394,Pubiotomy to assist del,Pubiotomy to assist delivery,Puiotomy
3103,7938,Open reduct-int fix toe,"Open reduction of fracture with internal fixation, phalanges of foot",Foot Fracture Reduction
3104,7939,Opn fx red w int fix NEC,"Open reduction of fracture with internal fixation, other specified bone",Bone Reduction and Internal Fixation
3105,7940,Cls reduc-sep epiphy NOS,"Closed reduction of separated epiphysis, unspecified site",Epiphysis Reduction
3106,7941,Close red-humerus epiphy,"Closed reduction of separated epiphysis, humerus",Humerus Reduction
3107,7942,Cls red-radius/ul epiphy,"Closed reduction of separated epiphysis, radius and ulna",Radial Ulna Reduction
3108,7945,Close reduc-femur epiphy,"Closed reduction of separated epiphysis, femur",Femur Reduction
3109,7946,Cls red-tibia/fib epiphy,"Closed reduction of separated epiphysis, tibia and fibula",Tibia and Fibula Reduction
3110,7949,Cls reduc-sep epiphy NEC,"Closed reduction of separated epiphysis, other specified bone",Bone Reduction
3111,7950,Open red-sep epiphy NOS,"Open reduction of separated epiphysis, unspecified site",Epiphysis Reduction
3112,7951,Opn red-sep epiphy-humer,"Open reduction of separated epiphysis, humerus",Humerus Reduction
3113,7952,Op red-radius/uln epiphy,"Open reduction of separated epiphysis, radius and ulna",Radial-Ulna Reduction
3114,7955,Opn red-sep epiphy-femur,"Open reduction of separated epiphysis, femur",Femur Reduction
3115,8135,Refus drs/drslmb pst/pst,"Refusion of dorsal and dorsolumbar spine, posterior column, posterior technique",Posterior Spine Fusion
3116,8136,Refus lmb/lmbsac ant/ant,"Refusion of lumbar and lumbosacral spine, anterior column, anterior technique",Anterior Lumbar Spine Fusion
3117,8137,Refus lmb/lmbsac pst/pst,"Refusion of lumbar and lumbosacral spine, posterior column, posterior technique",Posterior Spine Refusion
3118,8138,Refus lmb/lmbsc ant/post,"Refusion of lumbar and lumbosacral spine, anterior column, posterior technique",Anterior Column Refusion of Lumbar and Lumbosacral Spine
3119,8139,Refusion of spine NEC,"Refusion of spine, not elsewhere classified",Spine Refusion
3120,8140,"Repair of hip, NEC","Repair of hip, not elsewhere classified",Hip Repair
3121,8142,Five-in-one knee repair,Five-in-one repair of knee,Knee Repair
3122,8143,Triad knee repair,Triad knee repair,Knee Repair
3123,8144,Patellar stabilization,Patellar stabilization,Knee Stabilization
3124,8145,Cruciate lig repair NEC,Other repair of the cruciate ligaments,Cruciate Ligament Repair
3125,8146,Collaterl lig repair NEC,Other repair of the collateral ligaments,Collateral Ligament Repair
3126,8147,Other repair of knee,Other repair of knee,Knee Repair
3127,8149,Other repair of ankle,Other repair of ankle,Ankle Repair
3128,8151,Total hip replacement,Total hip replacement,Hip Replacement
3129,8152,Partial hip replacement,Partial hip replacement,Hip Replacement
3130,8153,Revise hip replacemt NOS,"Revision of hip replacement, not otherwise specified",Hip Revision
3131,8154,Total knee replacement,Total knee replacement,Knee Replacement
3132,8155,Revise knee replace NOS,"Revision of knee replacement, not otherwise specified",Rev Knee Replacement
3133,8156,Total ankle replacement,Total ankle replacement,Ankle Replacement
3134,8157,"Repl joint of foot, toe",Replacement of joint of foot and toe,Foot and Toe Joint Replacement
3135,8159,Rev jt repl low ext NEC,"Revision of joint replacement of lower extremity, not elsewhere classified",Revision Joint Replacement
3136,6759,Oth rep int cervical os,Other repair of internal cervical os,Cervical Os Repair
3137,6761,Suture cervical lacerat,Suture of laceration of cervix,Cervix Laceration Suture
3138,6762,Cervical fistula repair,Repair of fistula of cervix,Cervical Fistula Repair
3139,7399,Ops assisting deliv NEC,Other operations assisting delivery,Assisting Delivery
3140,740,Classical c-section,Classical cesarean section,Cesarean Section
3141,741,Low cervical c-section,Low cervical cesarean section,Low C-Section
3142,742,Extraperitoneal c-sect,Extraperitoneal cesarean section,Cesarean Section
3143,743,Rem extratub ectop preg,Removal of extratubal ectopic pregnancy,Extratubal Ectopic Pregnancy Removal
3144,744,Cesarean section NEC,Cesarean section of other specified type,Cesarean Section
3145,8773,Intravenous pyelogram,Intravenous pyelogram,IV Pyelogram
3146,8774,Retrograde pyelogram,Retrograde pyelogram,Pyelogram
3147,8775,Percutaneous pyelogram,Percutaneous pyelogram,Pyelogram
3148,8776,Retrogr cystourethrogram,Retrograde cystourethrogram,Cystourethrogram
3149,8777,Cystogram NEC,Other cystogram,Cystogram
3150,8778,Ileal conduitogram,Ileal conduitogram,Ileal Conduitogram
3151,8779,Urinary system x-ray NEC,Other x-ray of the urinary system,Urinary System X-ray
3152,8781,X-ray of gravid uterus,X-ray of gravid uterus,Gravid Uterus X-ray
3153,8782,Gas hysterosalpingogram,Gas contrast hysterosalpingogram,Hysterosalpingogram
3154,8783,Dye hysterosalpingogram,Opaque dye contrast hysterosalpingogram,Hysterosalpingogram
3155,8784,Percutaneous hysterogram,Percutaneous hysterogram,Hysterosalpingography
3156,8785,Tube & uterus x-ray NEC,Other x-ray of fallopian tubes and uterus,Fallopian Tube and Uterus X-ray
3157,8789,Female genital x-ray NEC,Other x-ray of female genital organs,Female Genital X-ray
3158,8791,Contr semin vesiculogram,Contrast seminal vesiculogram,Seminal Vesiculogram
3159,8792,Prostat/sem ves xray NEC,Other x-ray of prostate and seminal vesicles,Prostate and Seminal Vesicles X-ray
3160,8793,Contrast epididymogram,Contrast epididymogram,Epididymogram
3161,8794,Contrast vasogram,Contrast vasogram,Vasogram
3162,8795,Epididymis/vas x-ray NEC,Other x-ray of epididymis and vas deferens,Epididymis and Vas Deferens X-ray
3163,8799,Male genital x-ray NEC,Other x-ray of male genital organs,Genital X-ray
3164,8801,C.A.T. scan of abdomen,Computerized axial tomography of abdomen,CAT Scan of Abdomen
3165,8802,Abdominal tomography NEC,Other abdomen tomography,Abdominal Tomography
3166,8803,Abdominal wall sinogram,Sinogram of abdominal wall,Abdominal Sinogram
3167,8804,Abdominal lymphangiogram,Abdominal lymphangiogram,Lymphangiogram
3168,8809,Abdominal wall x-ray NEC,Other soft tissue x-ray of abdominal wall,Abdominal Wall X-ray
3169,8811,Pelvic dye contrast xray,Pelvic opaque dye contrast radiography,Pelvic Dye Contrast Radiography
3170,8812,Pelvic gas contrast xray,Pelvic gas contrast radiography,Pelvic Gas Contrast Radiography
3171,8813,Periton pneumogram NEC,Other peritoneal pneumogram,Peritoneal Pneumogram
3172,8814,Retroperiton fistulogram,Retroperitoneal fistulogram,Retroperitoneal Fistulogram
3173,8815,Retroperiton pneumogram,Retroperitoneal pneumogram,Retroperitoneal Pneumogram
3174,8816,Retroperitoneal xray NEC,Other retroperitoneal x-ray,Retroperitoneal X-ray
3175,8819,Abdominal x-ray NEC,Other x-ray of abdomen,Abdominal X-ray
3176,8821,Skl xray-shoulder/up arm,Skeletal x-ray of shoulder and upper arm,Shoulder X-ray
3177,8822,Skel xray-elbow/forearm,Skeletal x-ray of elbow and forearm,Elbow and Forearm X-ray
3178,9461,Alcohol rehabilitation,Alcohol rehabilitation,Rehab
3179,9462,Alcohol detoxification,Alcohol detoxification,Detoxification
3180,9463,Alcohol rehab/detox,Alcohol rehabilitation and detoxification,Detoxification and Rehabilitation
3181,9464,Drug rehabilitation,Drug rehabilitation,Drug Rehab
3182,9465,Drug detoxification,Drug detoxification,Detoxification
3183,9466,Drug rehab/detox,Drug rehabilitation and detoxification,Detoxification
3184,9467,Comb alcohol/drug rehab,Combined alcohol and drug rehabilitation,Drug and Alcohol Rehab
3185,9468,Comb alcohol/drug detox,Combined alcohol and drug detoxification,Detoxification
3186,9469,Comb alco/drug reha/deto,Combined alcohol and drug rehabilitation and detoxification,Detoxification and Rehabilitation
3187,8823,Skel xray-wrist & hand,Skeletal x-ray of wrist and hand,Wrist and Hand X-ray
3188,8824,Skel xray-upper limb NOS,"Skeletal x-ray of upper limb, not otherwise specified",Upper Limb X-ray
3189,8825,Pelvimetry,Pelvimetry,Pelvic Exam
3190,8826,Skel xray-pelvis/hip NEC,Other skeletal x-ray of pelvis and hip,Pelvic and Hip X-ray
3191,8827,Skel xray-thigh/knee/leg,"Skeletal x-ray of thigh, knee, and lower leg",Thigh Knee and Lower Leg X-ray
3192,8828,Skel xray-ankle & foot,Skeletal x-ray of ankle and foot,Ankle and Foot X-ray
3193,8829,Skel xray-lower limb NOS,"Skeletal x-ray of lower limb, not otherwise specified",Lower Limb X-ray
3194,8831,Skeletal series x-ray,Skeletal series,X-rays
3195,8832,Contrast arthrogram,Contrast arthrogram,Arthrogram
3196,8833,Other skeletal x-ray,Other skeletal x-ray,Skeletal X-ray
3197,8834,Upper limb lymphangiogrm,Lymphangiogram of upper limb,Lymphangiography
3198,8835,Up limb sft tis xray NEC,Other soft tissue x-ray of upper limb,Upper Limb Soft Tissue X-ray
3199,8836,Lower limb lymphangiogrm,Lymphangiogram of lower limb,Lower Limb Lymphangiogram
3200,8837,Lo limb sft tis xray NEC,Other soft tissue x-ray of lower limb,Lower Limb Soft Tissue X-ray
3201,8838,Other C.A.T. scan,Other computerized axial tomography,CAT Scan
3202,8839,X-ray NEC and NOS,"X-ray, other and unspecified",Other X-ray
3203,8840,Contrast arteriogram NOS,"Arteriography using contrast material, unspecified site",Angiography
3204,8841,Contr cerebr arteriogram,Arteriography of cerebral arteries,Cerebral Arteriography
3205,8842,Contrast aortogram,Aortography,Aortography
3206,8843,Contr pulmon arteriogram,Arteriography of pulmonary arteries,Pulmonary Arteriography
3207,8844,Contr thor arteriogr NEC,Arteriography of other intrathoracic vessels,Thoracic Arteriography
3208,8845,Contrast renal arteriogr,Arteriography of renal arteries,Renal Arteriography
3209,8846,Contrast placentogram,Arteriography of placenta,Placental Arteriography
3210,8847,Contr abd arteriogrm NEC,Arteriography of other intra-abdominal arteries,Intra-Abdominal Arteriography
3211,8848,Contrast arteriogram-leg,Arteriography of femoral and other lower extremity arteries,Lower Extremity Arteriography
3212,8849,Contrast arteriogram NEC,Arteriography of other specified sites,Angiography
3213,8850,Angiocardiography NOS,"Angiocardiography, not otherwise specified",Angio
3214,8851,Vena cav angiocardiogram,Angiocardiography of venae cavae,Vena Cava Angiocardiography
3215,8852,Rt heart angiocardiogram,Angiocardiography of right heart structures,Right Heart Angiocardiography
3216,8853,Lt heart angiocardiogram,Angiocardiography of left heart structures,Left Heart Angiocardiography
3217,8854,Rt & lt heart angiocard,Combined right and left heart angiocardiography,Angiocardiography
3218,8855,Coronar arteriogr-1 cath,Coronary arteriography using a single catheter,Coronary Arteriography
3219,8856,Coronar arteriogr-2 cath,Coronary arteriography using two catheters,Coronary Arteriography
3220,8857,Coronary arteriogram NEC,Other and unspecified coronary arteriography,Coronary Arteriography
3221,8858,Negatve-contr cardiogram,Negative-contrast cardiac roentgenography,Negative-Contrast Cardiac Roentgenography
3222,8859,Intraop cor flr vas angi,Intra-operative coronary fluorescence vascular angiography,Coronary Fluorescence Angiography
3223,8860,Contrast phlebogram NOS,"Phlebography using contrast material, unspecified site",Phlebography
3224,8861,Contr phlebogram-hd/neck,Phlebography of veins of head and neck using contrast material,Head and Neck Phlebography
3225,8862,Contr phlebogram-pulmon,Phlebography of pulmonary veins using contrast material,Pulmonary Vein Phlebography
3226,8863,Thorac contr phlebog NEC,Phlebography of other intrathoracic veins using contrast material,Thoracic Phlebography
3227,8864,Portal contr phlebogram,Phlebography of the portal venous system using contrast material,Portal Venous Phlebography
3228,8865,Abd contr phlebogram NEC,Phlebography of other Intra-Abdominal veins using contrast material,Intra-Abdominal Vein Phlebography
3229,8866,Contrast phlebogram-leg,Phlebography of femoral and other lower extremity veins using contrast material,Femoral Vein Phlebography
3230,8867,Contrast phlebogram NEC,Phlebography of other specified sites using contrast material,Phlebography
3231,8868,Impedance phlebogram,Impedance phlebography,Phlebography
3232,8871,Dx ultrasound-head/neck,Diagnostic ultrasound of head and neck,Head and Neck Ultrasound
3233,8872,Dx ultrasound-heart,Diagnostic ultrasound of heart,Heart Ultrasound
3234,8873,Dx ultrasound-thorax NEC,Diagnostic ultrasound of other sites of thorax,Thoracic Ultrasound
3235,8874,Dx ultrasound-digestive,Diagnostic ultrasound of digestive system,Digestive System Ultrasound
3236,8875,Dx ultrasound-urinary,Diagnostic ultrasound of urinary system,Urinary System Ultrasound
3237,8876,Dx ultrasound-abdomen,Diagnostic ultrasound of abdomen and retroperitoneum,Abdominal Ultrasound
3238,8877,Dx ultrasound-vascular,Diagnostic ultrasound of peripheral vascular system,Peripheral Vascular Ultrasound
3239,8878,Dx ultrasound-grav uter,Diagnostic ultrasound of gravid uterus,Uterine Ultrasound
3240,8879,Dx ultrasound NEC,Other diagnostic ultrasound,Diagnostic Ultrasound
3241,8881,Cerebral thermography,Cerebral thermography,Thermography
3242,8882,Ocular thermography,Ocular thermography,Thermography
3243,8883,Bone thermography,Bone thermography,Bone Thermography
3244,9501,Limited eye examination,Limited eye examination,Eye Examination
3245,9502,Comprehensive eye exam,Comprehensive eye examination,Eye Exam
3246,9503,Extended ophthal work-up,Extended ophthalmologic work-up,Ophthalmologic Work-up
3247,9504,Anesthetized eye exam,Eye examination under anesthesia,Eye Anesthesia
3248,9505,Visual field study,Visual field study,Visual Field Test
3249,9506,Color vision study,Color vision study,Color Vision Test
3250,9507,Dark adaptation study,Dark adaptation study,Dark Adaptation Test
3251,9509,Eye examination NOS,"Eye examination, not otherwise specified",Eye Exam
3252,9511,Fundus photography,Fundus photography,Fundus Exam
3253,9512,Eye fluorescein angiogra,Fluorescein angiography or angioscopy of eye,Eye Angiography
3254,9513,Ultrasound study of eye,Ultrasound study of eye,Eye Ultrasound
3255,9514,X-ray study of eye,X-ray study of eye,Eye X-ray
3256,9515,Ocular motility study,Ocular motility study,Ocular Motility Test
3257,9516,P32 & eye tracer NEC,P32 and other tracer studies of eye,Eye Tracer Studies
3258,9521,Electroretinogram,Electroretinogram [ERG],ERG
3259,9522,Electro-oculogram,Electro-oculogram [EOG],EOG
3260,8884,Muscle thermography,Muscle thermography,Thermography
3261,8885,Breast thermography,Breast thermography,Thermography
3262,8886,Blood vessel thermograph,Blood vessel thermography,Thermography
3263,8889,Thermography NEC,Thermography of other sites,Thermography
3264,8890,Diagnostic imaging NOS,"Diagnostic imaging, not elsewhere classified",Imaging Studies
3265,8891,Mri of brain & brainstem,Magnetic resonance imaging of brain and brain stem,Brain MRI
3266,8892,Mri chest & heart,Magnetic resonance imaging of chest and myocardium,Chest MRI
3267,8893,Mri spinal canal,Magnetic resonance imaging of spinal canal,Spinal MRI
3268,8894,Mri musculoskeletal,Magnetic resonance imaging of musculoskeletal,Musculoskeletal MRI
3269,8895,"Mri pelvis,prostate,blad","Magnetic resonance imaging of pelvis, prostate, and bladder",Pelvic MRI
2640,8896,Oth intraop mag res imag,Other intraoperative magnetic resonance imaging,Intraoperative MRI
2641,8897,Magnetic res image unsp,Magnetic resonance imaging of other and unspecified sites,Other MRI
2642,8898,Bone mineral density,Bone mineral density studies,BMD Study
2643,8901,Brief interview & evalua,"Interview and evaluation, described as brief",Brief Interview and Evaluation
2644,8902,Limited interview/evalua,"Interview and evaluation, described as limited",Limited Evaluation and Interview
2645,8903,Comprehen interview/eval,"Interview and evaluation, described as comprehensive",Comprehensive Evaluation
2646,8904,Interview & evaluat NEC,Other interview and evaluation,Other Evaluation
2647,8905,Interview & evaluat NOS,"Diagnostic interview and evaluation, not otherwise specified",Diagnostic Evaluation
2648,8906,Limited consultation,"Consultation, described as limited",Limited Consultation
2649,8907,Comprehensive consultat,"Consultation, described as comprehensive",Comprehensive Consultation
2650,8908,Consultation NEC,Other consultation,Consultation
2651,8909,Consultation NOS,"Consultation, not otherwise specified",Consultation
2652,8910,Intracarot amobarb test,Intracarotid amobarbital test,Amobarbital Test
2653,8911,Tonometry,Tonometry,Intraocular Pressure Measurement
2654,8912,Nasal function study,Nasal function study,Nasal Function Test
2655,8913,Neurologic examination,Neurologic examination,Neuro Exam
2656,8914,Electroencephalogram,Electroencephalogram,EEG
2657,8915,Neurologic func test NEC,Other nonoperative neurologic function tests,Neurologic Function Tests
2658,8916,Skull transilluminat,Transillumination of newborn skull,Newborn Skull Transillumination
2659,8917,Polysomnogram,Polysomnogram,Sleep Study
2660,8918,Oth sleep dis funct test,Other sleep disorder function tests,Sleep Disorder Function Tests
2661,8919,Video/radio eeg monitor,Video and radio-telemetered electroencephalographic monitoring,Video and Radio-telemetered EEG Monitoring
2662,8921,Urinary manometry,Urinary manometry,Urinary Manometry
2663,8922,Cystometrogram,Cystometrogram,Urinary Function Test
2664,8923,Urethral sphincter emg,Urethral sphincter electromyogram,Urethral Sphincter EMG
2665,8924,Uroflowmetry,Uroflowmetry [UFR],Uroflowmetry
2666,8925,Urethral pressure profil,Urethral pressure profile [UPP],Urethral Pressure Profile
2667,8926,Gynecologic examination,Gynecological examination,GYN Exam
2668,8929,Other gu system exams,Other nonoperative genitourinary system measurements,Genitourinary System Measurements
2669,8931,Dental examination,Dental examination,Dental Exam
2670,8932,Esophageal manometry,Esophageal manometry,Esophageal Manometry
2671,8933,Digital enterostomy exam,Digital examination of enterostomy stoma,Enterostomy Stoma Examination
2672,8934,Digital rectal exam,Digital examination of rectum,Digital Rectal Examination
2673,8935,Nasal sinus transillumin,Transillumination of nasal sinuses,Nasal Sinus Transillumination
2674,8936,Manual exam of breast,Manual examination of breast,Breast Examination
2675,8937,Vital capacity determin,Vital capacity determination,Vital Capacity
2676,8938,Respiratory measure NEC,Other nonoperative respiratory measurements,Respiratory Measurements
2677,8939,Nonoperative exams NEC,Other nonoperative measurements and examinations,Other Nonoperative Measurements
2678,8941,Treadmill stress test,Cardiovascular stress test using treadmill,Treadmill Stress Test
2679,8942,Masters' 2-step test,Masters' two-step stress test,Stress Test
2680,8943,Bicycle ergometer test,Cardiovascular stress test using bicycle ergometer,Ergometer Stress Test
2681,8944,Cardiac stress test NEC,Other cardiovascular stress test,Stress Test
2682,8945,Pacemaker rate check,Artificial pacemaker rate check,Pacemaker Rate Check
2683,8946,Pacemaker wave form chck,Artificial pacemaker artifact wave form check,Pacemaker Waveform Check
2684,8947,Pacemaker impedance chck,Artificial pacemaker electrode impedance check,Pacemaker Impedance Check
2685,8948,Pacemaker volt threshold,Artificial pacemaker voltage or amperage threshold check,Pacemaker Threshold Check
2686,8949,AICD check,Automatic implantable cardioverter/defibrillator (AICD) check,AICD Check
2687,8950,Ambu cardiac monitoring,Ambulatory cardiac monitoring,Ambulatory Cardiac Monitoring
2688,8951,Rhythm electrocardiogram,Rhythm electrocardiogram,ECG Rhythm
2689,8952,Electrocardiogram,Electrocardiogram,ECG
2690,8953,Vectorcardiogram,Vectorcardiogram (with ECG),Vectorcardiogram
2691,8954,Electrocardiograph monit,Electrographic monitoring,EGM
2692,8955,Phonocardiogram,Phonocardiogram with ECG lead,Phonocardiogram
2693,8956,Carotid pulse tracing,Carotid pulse tracing with ECG lead,Carotid Pulse Tracing
2694,8957,Apexcardiogram,Apexcardiogram (with ECG lead),Apex Cardiogram
2695,8958,Plethysmogram,Plethysmogram,Plethysmography
2696,8959,Nonop cardiac/vasc exam,Other nonoperative cardiac and vascular measurements,Nonoperative Cardiac and Vascular Measurements
2697,8960,Cnt intraart bld gas mon,Continuous intra-arterial blood gas monitoring,Continuous Arterial Blood Gas Monitoring
2698,9523,Visual evoked potential,Visual evoked potential [VEP],VEP
2699,9524,Electronystagmogram,Electronystagmogram [ENG],Vestibular Testing
2700,9525,Electromyogram of eye,Electromyogram of eye [EMG],Eye EMG
2701,9526,Glaucoma testing,"Tonography, provocative tests, and other glaucoma testing",Glaucoma Testing
